{
  "$schema": "https://json-schema.org/draft/2020-12/schema",
  "title": "Definición de periférico de GnoHub",
  "type": "object",
  "required": [
    "name",
    "match"
  ],
  "additionalProperties": false,
  "properties": {
    "$schema": {
      "type": "string"
    },
    "name": {
      "type": "string",
      "description": "Nombre del modelo."
    },
    "kind": {
      "enum": [
        "mouse",
        "keyboard",
        "gamepad",
        "other"
      ],
      "default": "mouse"
    },
    "match": {
      "type": "array",
      "minItems": 1,
      "description": "VID:PID en hexadecimal (`gnohubd list` los muestra). Varios si el modelo tiene variantes, p. ej. con cable e inalámbrico.",
      "items": {
        "type": "string",
        "pattern": "^[0-9a-fA-F]{1,4}:[0-9a-fA-F]{1,4}$"
      }
    },
    "image": {
      "type": "string",
      "description": "Imagen SVG, PNG, JPG o WebP, relativa a este archivo. Vista superior recomendada."
    },
    "notes": {
      "oneOf": [
        {
          "type": "string"
        },
        {
          "type": "object",
          "description": "Un texto por idioma, p. ej. { \"en\": \"Side back\", \"es\": \"Lateral atrás\" }.",
          "additionalProperties": {
            "type": "string"
          },
          "minProperties": 1
        }
      ],
      "description": "Ayuda que se muestra en la página del dispositivo (texto o uno por idioma)."
    },
    "buttons": {
      "type": "array",
      "items": {
        "type": "object",
        "required": [
          "id",
          "label"
        ],
        "additionalProperties": false,
        "properties": {
          "id": {
            "type": "string",
            "description": "Nombre corto impreso en el periférico o el manual (G4, M1…)."
          },
          "label": {
            "$ref": "#/definitions/text",
            "description": "Qué es el botón (texto o uno por idioma)."
          },
          "emits": {
            "type": "string",
            "description": "Evento que envía de fábrica: BTN_*, KEY_* o WHEEL_UP/DOWN/LEFT/RIGHT. Omítelo si lo gestiona el firmware."
          },
          "hw_index": {
            "type": "integer",
            "minimum": 0,
            "description": "Índice del botón en libratbag/ratbagd (Piper lo muestra), para leer y reprogramar su función interna."
          },
          "x": {
            "type": "number",
            "minimum": 0,
            "maximum": 1,
            "description": "Posición horizontal en la imagen (0 = izquierda)."
          },
          "y": {
            "type": "number",
            "minimum": 0,
            "maximum": 1,
            "description": "Posición vertical en la imagen (0 = arriba)."
          }
        }
      }
    }
  },
  "definitions": {
    "text": {
      "oneOf": [
        {
          "type": "string"
        },
        {
          "type": "object",
          "description": "Un texto por idioma, p. ej. { \"en\": \"Side back\", \"es\": \"Lateral atrás\" }.",
          "additionalProperties": {
            "type": "string"
          },
          "minProperties": 1
        }
      ]
    }
  }
}
